{
  "id": "auth.cert.disabled-server",
  "title": "Cert login against a server with the backend disabled maps to UnsupportedByServer",
  "capturedFrom": "BastionVault 0.42.x (derived from crates/bv-server and crates/bv-client behaviour)",
  "requirements": [
    "AUT-070"
  ],
  "level": "complete",
  "sections": [
    "05"
  ],
  "client": {
    "address": "https://vault.example.com:8200",
    "token": null,
    "namespace": "",
    "apiPrefix": "v1",
    "settings": {
      "RateGate": {
        "RatePerSecond": 0
      },
      "RetryPolicy": {
        "MaxAttempts": 1
      }
    }
  },
  "operation": {
    "name": "Auth.Cert.Login",
    "args": {
      "mount": "cert"
    }
  },
  "exchanges": [
    {
      "expectRequest": {
        "method": "POST",
        "url": "https://vault.example.com:8200/v1/auth/cert/login"
      },
      "respond": {
        "status": 404,
        "body": {
          "error": "Router mount not found."
        }
      }
    }
  ],
  "expect": {
    "error": {
      "code": "BV-SERVER-004",
      "statusCode": 404,
      "retryable": false,
      "hintContains": [
        "cert"
      ]
    }
  }
}
