{
  "id": "transport.headers.authenticated-read",
  "title": "Authenticated GET sends X-BastionVault-Token and Accept, no cookie or Vault header",
  "capturedFrom": "BastionVault 0.42.x (derived from crates/bv-server and crates/bv-client behaviour)",
  "requirements": [
    "TRN-013",
    "TRN-016",
    "OVR-001"
  ],
  "level": "core",
  "sections": [
    "03"
  ],
  "client": {
    "address": "https://vault.example.com:8200",
    "token": "s.FAKEtoken0000000000000000",
    "namespace": "",
    "apiPrefix": "v1",
    "settings": {
      "RateGate": {
        "RatePerSecond": 0
      },
      "RetryPolicy": {
        "MaxAttempts": 1
      }
    }
  },
  "operation": {
    "name": "Logical.Read",
    "args": {
      "path": "secret/data/app/db"
    }
  },
  "exchanges": [
    {
      "expectRequest": {
        "method": "GET",
        "url": "https://vault.example.com:8200/v1/secret/data/app/db",
        "headers": {
          "X-BastionVault-Token": "s.FAKEtoken0000000000000000",
          "Accept": "application/json"
        },
        "absentHeaders": [
          "Cookie",
          "X-Vault-Token",
          "Authorization",
          "X-BastionVault-Namespace"
        ],
        "body": null
      },
      "respond": {
        "status": 200,
        "body": {
          "renewable": false,
          "lease_id": "",
          "lease_duration": 0,
          "auth": null,
          "data": {
            "data": {
              "k": "v"
            },
            "metadata": {
              "version": 1
            }
          }
        }
      }
    }
  ],
  "expect": {
    "result": {
      "Data": {
        "data": {
          "k": "v"
        },
        "metadata": {
          "version": 1
        }
      },
      "LeaseId": "$absent",
      "Auth": "$absent"
    }
  }
}
