{
  "id": "auth.ferrogate.requirement-unauthenticated",
  "title": "FerroGate requirement is readable with no token and carries no token header",
  "capturedFrom": "BastionVault 0.42.x (derived from crates/bv-server and crates/bv-client behaviour)",
  "requirements": [
    "AUT-051",
    "CFG-020"
  ],
  "level": "standard",
  "sections": [
    "05"
  ],
  "client": {
    "address": "https://vault.example.com:8200",
    "token": null,
    "namespace": "",
    "apiPrefix": "v1",
    "settings": {
      "RateGate": {
        "RatePerSecond": 0
      },
      "RetryPolicy": {
        "MaxAttempts": 1
      }
    }
  },
  "operation": {
    "name": "Auth.Ferrogate.Requirement",
    "args": {
      "mount": "ferrogate"
    }
  },
  "exchanges": [
    {
      "expectRequest": {
        "method": "GET",
        "url": "https://vault.example.com:8200/v1/auth/ferrogate/requirement",
        "absentHeaders": [
          "X-BastionVault-Token"
        ]
      },
      "respond": {
        "status": 200,
        "body": {
          "renewable": false,
          "lease_id": "",
          "lease_duration": 0,
          "auth": null,
          "data": {
            "require_machine_identity": true,
            "expected_audience": "bastionvault",
            "trust_domain": "spiffe://example.internal",
            "mia_environment": "prod"
          }
        }
      }
    }
  ],
  "expect": {
    "result": {
      "RequireMachineIdentity": true,
      "ExpectedAudience": "bastionvault",
      "TrustDomain": "spiffe://example.internal",
      "MiaEnvironment": "prod"
    }
  }
}
